form,source,title,author,content,poem_link-href,year,meter_pattern,rhyme_pattern,theme,imagery
Limerick,poetry_foundation,There was an Old Man with a Beard,Edward Lear,"There was an Old Man with a beard,
Who said, ""It is just as I feared! - 
Two Owls and a Hen, four Larks and a Wren,
Have all built their nests in my beard.",https://www.poetryfoundation.org/poems/45755/there-was-an-old-man-with-a-beard,,,AABA,About an old man with a beard,"owls, hen"
Limerick,poetry_foundation,There was an Old Person of Nice,Edward Lear,"There was an old person of Nice,
Whose associates were usually Geese.
They walked out together, in all sorts of weather.
That affable person of Nice!",https://www.poetryfoundation.org/poems/44609/there-was-an-old-person-of-nice,,,AABA,About an old person of Nice,weather
Limerick,poetry_foundation,There was an Old Man on the Border,Edward Lear,"There was an old man on the Border,
Who lived in the utmost disorder;
He danced with the cat, and made tea in his hat,
Which vexed all the folks on the Border.",https://www.poetryfoundation.org/poems/44608/there-was-an-old-man-on-the-border,,,AABA,About an old man on the border,
Limerick,poetry_foundation,There was an Old Man of Thermopylæ,Edward Lear,"There was an old man of Thermopylæ,
Who never did anything properly;
But they said, ""If you choose, To boil eggs in your shoes,
You shall never remain in Thermopylæ.""",https://www.poetryfoundation.org/poems/44607/there-was-an-old-man-of-thermopylae,,,AABA,About an old man of Thermopylæ,
Limerick,poetry_foundation,A Young Lady of Lynn,Anonymous,"There was a young lady of Lynn,
Who was so uncommonly thin
That when she essayed
To drink lemonade
She slipped through the straw and fell in.",https://www.poetryfoundation.org/poems/42910/a-young-lady-of-lynn,,,AABBA,About a young lady of Lynn,drink
Ballad,poetry_foundation,To One Unknown,Helen Dudley,"I have seen the proudest stars
That wander on through space,
Even the sun and moon,
But not your face.

I have heard the violin,
The winds and waves rejoice
in endless minstrelsy,
Yet not your voice.

I have touched the trillium,
Pale flower of the land,
Coral, anemone,
And not your hand.

I have kissed the shining feet
Of Twilight lover-wise,
Opened the gates of Dawn - 
Oh not your eyes!

I have dreamed unwonted things,
Visions that witches brew,
Spoken with images,
Never with you.",https://www.poetryfoundation.org/poetrymagazine/poems/12583/to-one-unknown,,,ABCB,"About the unknown lover and the search of rare, hidden love","face, anemone, waves, flower, winds, eyes, stars, moon"
Ballad,poetry_foundation,The Ballad of God-Makers,G. K. Chesterton,"A bird flew out at the break of day
From the nest where it had curled,
And ere the eve the bird had set
Fear on the kings of the world.

The first tree it lit upon
Was green with leaves unshed;
The second tree it lit upon
Was red with apples red;

The third tree it lit upon
Was barren and was brown,
Save for a dead man nailed thereon
On a hill above a town.

That night the kings of the earth were gay
And filled the cup and can;
Last night the kings of the earth were chill
For dread of a naked man.

‘If he speak two more words,’ they said,
‘The slave is more than the free;
If he speak three more words,’ they said,
‘The stars are under the sea.’

Said the King of the East to the King of the West,
I wot his frown was set,
‘Lo, let us slay him and make him as dung,
It is well that the world forget.’

Said the King of the West to the King of the East,
I wot his smile was dread,
‘Nay, let us slay him and make him a god,
It is well that our god be dead.’

They set the young man on a hill,
They nailed him to a rod;
And there in darkness and in blood
They made themselves a god.

And the mightiest word was left unsaid,
And the world had never a mark,
And the strongest man of the sons of men
Went dumb into the dark.

Then hymns and harps of praise they brought,
Incense and gold and myrrh,
And they thronged above the seraphim,
The poor dead carpenter.

‘Thou art the prince of all,’ they sang,
‘Ocean and earth and air.’
Then the bird flew on to the cruel cross,
And hid in the dead man’s hair.

‘Thou art the son of the world.’ they cried, `
‘Speak if our prayers be heard.’
And the brown bird stirred in the dead man’s hair
And it seemed that the dead man stirred.

Then a shriek went up like the world’s last cry
From all nations under heaven,
And a master fell before a slave
And begged to be forgiven.

They cowered, for dread in his wakened eyes
The ancient wrath to see;
And a bird flew out of the dead Christ’s hair,
And lit on a lemon tree.",https://www.poetryfoundation.org/poems/47921/the-ballad-of-god-makers,,,ABCB,About the kings of the earth killing Christ and making him god ,"air, apples, ocean, tree, god, eyes, bird, stars, sea, mark, hill"
Ballad,poetry_foundation,Similar Cases,Charlotte Anna Perkins Gilman,"There was once a little animal,
No bigger than a fox,
And on five toes he scampered
Over Tertiary rocks.
They called him Eohippus,
And they called him very small,
And they thought him of no value --
When they thought of him at all;
For the lumpish old Dinoceras
And Coryphodon so slow
Were the heavy aristocracy
In days of long ago.

Said the little Eohippus,
“I am going to be a horse!
And on my middle finger-nails
To run my earthly course!
I’m going to have a flowing tail!
I’m going to have a mane!
I’m going to stand fourteen hands high
On the psychozoic plain!”

The Coryphodon was horrified,
The Dinoceras was shocked;
And they chased young Eohippus,
But he skipped away and mocked.
Then they laughed enormous laughter,
And they groaned enormous groans.
And they bade young Eohippus
Go view his father’s bones.
Said they, “You always were as small
And mean as now we see,
And that’s conclusive evidence
That you’re always going to be.
What! Be a great, tall, handsome beast,
With hoofs to gallop on?
Why! You’d have to change your nature!
Said the Loxolophodon.
They considered him disposed of,
And retired with gait serene;
That was the way they argued
In “the early Eocene”.
There was once an Anthropoidal Ape,
Far smarter than the rest,
And everything that they could do
He always did the best;
So they naturally disliked him
And they gave him shoulders cool,
And when they had to mention him
They said he was a fool.

Cried this pretentious Ape one day,
“I’m going to be a man!
And stand upright, and hunt, and fight,
And conquer all I can!
I’m going to cut down forest trees,
To make my houses higher!
I’m going to kill the Mastodon!
I’m going to make a fire!”

Loud screamed the Anthropoidal Apes
With laughter wild and gay;
They tried to catch that boastful one,
But he always got away.
So they yelled at him in chorus,
Which he minded not a whit;
And they pelted him with cocoanuts,
Which didn’t seem to hit.
And then they gave him reasons
Which they thought of much avail,
To prove how his preposterous
Attempt was sure to fail.
Said the sages, “In the first place,
The thing cannot be done!
And, second, if it could be,
It would not be any fun!
And, third, and most conclusive,
And admitting no reply,
You would have to change your nature!
We should like to see you try!”
They chuckled then triumphantly,
These lean and hairy shapes,
For these things passed as arguments
With the Anthropoidal Apes.

There was once a Neolithic Man,
An enterprising wight,
Who made his chopping implements
Unusually bright.
Unusually clever he,
Unusually brave,
And he drew delightful Mammoths
On the borders of his cave.
To his Neolithic neighbours,
Who were startled and surprised,
Said he, “My friends, in course of time,
We shall be civilized!
We are going to live in cities!
We are going to fight in wars!
We are going to eat three times a day
Without the natural cause!
We are going to turn life upside down
About a thing called gold!
We are going to want the earth, and take
As much as we can hold!
We are going to wear great piles of stuff
Outside our proper skins!
We are going to have Diseases!
And Accomplishments!! And Sins!!!”

Then they all rose up in fury
Against their boastful friend,
For prehistoric patience
Cometh quickly to an end.
Said one, “This is chimerical!
Utopian! Absurd!”
Said another, “What a stupid life!
Too dull, upon my word!”
Cried all, Before such things can come,
You idiotic child,
You must alter Human Nature!”
And they all sat back and smiled.
Thought they, “An answer to that last
It will be hard to find!”
It was a clinching argument
To the Neolithic Mind!",https://www.poetryfoundation.org/poems/46060/similar-cases,,,ABCB,About pursuing change and evolution full of resistance and criticism,"trees, animal, tail, beast, piles"
Ballad,poetry_foundation,Sing me a Song of a Lad that is Gone,Robert Louis Stevenson,"Sing me a song of a lad that is gone,
Say, could that lad be I?
Merry of soul he sailed on a day
Over the sea to Skye.

Mull was astern, Rum on the port,
Eigg on the starboard bow;
Glory of youth glowed in his soul;
Where is that glory now?

Sing me a song of a lad that is gone,
Say, could that lad be I?
Merry of soul he sailed on a day
Over the sea to Skye.

Give me again all that was there,
Give me the sun that shone!
Give me the eyes, give me the soul,
Give me the lad that's gone!

Sing me a song of a lad that is gone,
Say, could that lad be I?
Merry of soul he sailed on a day
Over the sea to Skye.

Billow and breeze, islands and seas,
Mountains of rain and sun,
All that was good, all that was fair,
All that was me is gone.",https://www.poetryfoundation.org/poems/45949/sing-me-a-song-of-a-lad-that-is-gone,,,ABCB,About aging and the loss of innocence,"mountains, seas, breeze, eyes, bow, sun, billow, sea"
Ballad,poetry_foundation,Yarrow Unvisited,William Wordsworth,"From Stirling castle we had seen
The mazy Forth unravelled;
Had trod the banks of Clyde, and Tay,
And with the Tweed had travelled;
And when we came to Clovenford,
Then said my ""winsome Marrow ,""
""Whate'er betide, we'll turn aside,
And see the Braes of Yarrow.""

""Let Yarrow folk, frae Selkirk town,
Who have been buying, selling,
Go back to Yarrow, 'tis their own;
Each maiden to her dwelling!
On Yarrow's banks let her herons feed,
Hares couch, and rabbits burrow!
But we will downward with the Tweed
Nor turn aside to Yarrow.

""There's Galla Water, Leader Haughs,
Both lying right before us;
And Dryborough, where with chiming Tweed
The lintwhites sing in chorus;
There's pleasant Tiviot-dale, a land
Made blithe with plough and harrow:
Why throw away a needful day
To go in search of Yarrow?

""What's Yarrow but a river bare,
That glides the dark hills under?
There are a thousand such elsewhere
As worthy of your wonder.""
 - Strange words they seemed of slight and scorn;
My True-love sighed for sorrow;
And looked me in the face, to think
I thus could speak of Yarrow!

""Oh! green,"" said I, ""are Yarrow's holms,
And sweet is Yarrow flowing!
Fair hangs the apple frae the rock,
But we will leave it growing.
O'er hilly path, and open Strath,
We'll wander Scotland thorough;
But, though so near, we will not turn
Into the dale of Yarrow.

""Let beeves and home-bred kine partake
The sweets of Burn-mill meadow,
The swan on still St. Mary's Lake
Float double, swan and shadow!
We will not see them; will not go,
To-day, nor yet to-morrow;
Enough if in our hearts we know
There's such a place as Yarrow.

""Be Yarrow stream unseen, unknown!
It must, or we shall rue it:
We have a vision of our own;
Ah! why should we undo it?
The treasured dreams of times long past,
We'll keep them, winsome Marrow!
For when we'er there, although 'tis fair,
'Twill be another Yarrow!

""If Care with freezing years should come,
And wandering seem but folly, - 
Should we be loth to stir from home,
And yet be melancholy;
Should life be dull, and spirits low,
'Twill soothe us in our sorrow,
That earth has something yet to show,
The bonny holms of Yarrow!""",https://www.poetryfoundation.org/poems/45568/yarrow-unvisited,,,ABCBDEFE,It is better not to go somewhere than to go and risk being disappointed,"river, face, apple, hills, spirits, stream, water"
Ballad,poetry_foundation,The Ballad of Reading Gaol: I,Oscar Wilde,"He did not wear his scarlet coat,
For blood and wine are red,
And blood and wine were on his hands
When they found him with the dead,
The poor dead woman whom he loved,
And murdered in her bed.

He walked amongst the Trial Men
In a suit of shabby gray;
A cricket cap was on his head,
And his step seemed light and gay;
But I never saw a man who looked
So wistfully at the day.

I never saw a man who looked
With such a wistful eye
Upon that little tent of blue
Which prisoners call the sky,
And at every drifting cloud that went
With sails of silver by.

I walked, with other souls in pain,
Within another ring,
And was wondering if the man had done
A great or little thing,
When a voice behind me whispered low,
""That fellow's got to swing.""

Dear Christ! the very prison walls
Suddenly seemed to reel,
And the sky above my head became
Like a casque of scorching steel;
And, though I was a soul in pain,
My pain I could not feel.

I only knew what hunted thought
Quickened his step, and why
He looked upon the garish day
With such a wistful eye;
The man had killed the thing he loved,
And so he had to die.

Yet each man kills the thing he loves,
By each let this be heard,
Some do it with a bitter look,
Some with a flattering word,
The coward does it with a kiss,
The brave man with a sword!

Some kill their love when they are young,
And some when they are old;
Some strangle with the hands of Lust,
Some with the hands of Gold:
The kindest use a knife, because
The dead so soon grow cold.

Some love too little, some too long,
Some sell, and others buy;
Some do the deed with many tears,
And some without a sigh:
For each man kills the thing he loves,
Yet each man does not die.

He does not die a death of shame
On a day of dark disgrace,
Nor have a noose about his neck,
Nor a cloth upon his face,
Nor drop feet foremost through the floor
Into an empty space.

He does not sit with silent men
Who watch him night and day;
Who watch him when he tries to weep,
And when he tries to pray;
Who watch him lest himself should rob
The prison of its prey.

He does not wake at dawn to see
Dread figures throng his room,
The shivering Chaplain robed in white,
The Sheriff stern with gloom,
And the Governor all in shiny black,
With the yellow face of Doom.

He does not rise in piteous haste
To put on convict-clothes,
While some coarse-mouthed Doctor gloats, and notes
Each new and nerve-twitched pose,
Fingering a watch whose little ticks
Are like horrible hammer-blows.

He does not know that sickening thirst
That sands one's throat, before
The hangman with his gardener's gloves
Slips through the padded door,
And binds one with three leathern thongs,
That the throat may thirst no more.

He does not bend his head to hear
The Burial Office read,
Nor while the terror of his soul
Tells him he is not dead,
Cross his own coffin, as he moves
Into the hideous shed.

He does not stare upon the air
Through a little roof of glass:
He does not pray with lips of clay
For his agony to pass;
Nor feel upon his shuddering cheek
The kiss of Caiaphas.",https://www.poetryfoundation.org/poems/45495/the-ballad-of-reading-gaol,,,ABCBDB,About the brutalisation of the punishment that all convicts share,"lips, blue, sky, sails, face, blows, prey, air, gloom, wine, reel, head, cloud, throat, neck, eye"
Ballad,poetry_foundation,The Lover: A Ballad,Lady Mary Wortley Montagu,"At length, by so much importunity press'd,
Take, C -  - , at once, the inside of my breast;
This stupid indiff'rence so often you blame,
Is not owing to nature, to fear, or to shame:
I am not as cold as a virgin in lead,
Nor is Sunday's sermon so strong in my head:
I know but too well how time flies along,
That we live but few years, and yet fewer are young.

But I hate to be cheated, and never will buy
Long years of repentance for moments of joy,
Oh! was there a man (but where shall I find
Good sense and good nature so equally join'd?)
Would value his pleasure, contribute to mine;
Not meanly would boast, nor would lewdly design;
Not over severe, yet not stupidly vain,
For I would have the power, tho' not give the pain.

No pedant, yet learned; no rake-helly gay,
Or laughing, because he has nothing to say;
To all my whole sex obliging and free,
Yet never be fond of any but me;
In public preserve the decorum that's just,
And shew in his eyes he is true to his trust;
Then rarely approach, and respectfully bow,
But not fulsomely pert, nor yet foppishly low.

But when the long hours of public are past,
And we meet with champagne and a chicken at last,
May ev'ry fond pleasure that moment endear;
Be banish'd afar both discretion and fear!
Forgetting or scorning the airs of the crowd,
He may cease to be formal, and I to be proud.
Till lost in the joy, we confess that we live,
And he may be rude, and yet I may forgive.

And that my delight may be solidly fix'd,
Let the friend and the lover be handsomely mix'd;
In whose tender bosom my soul may confide,
Whose kindness can soothe me, whose counsel can guide.
From such a dear lover as here I describe,
No danger should fright me, no millions should bribe;
But till this astonishing creature I know,
As I long have liv'd chaste, I will keep myself so.

I never will share with the wanton coquette,
Or be caught by a vain affectation of wit.
The toasters and songsters may try all their art,
But never shall enter the pass of my heart.
I loath the lewd rake, the dress'd fopling despise:
Before such pursuers the nice virgin flies:
And as Ovid has sweetly in parable told,
We harden like trees, and like rivers grow cold.",https://www.poetryfoundation.org/poems/44761/the-lover-a-ballad,,,AABBCCDD,About the search of an ideal lover ,"trees, breast, rivers, head, bow, eyes, airs, creature"
Ballad,poetry_foundation,Youth and Art,Robert Browning,"It once might have been, once only:
We lodged in a street together,
You, a sparrow on the housetop lonely,
I, a lone she-bird of his feather.

Your trade was with sticks and clay,
You thumbed, thrust, patted and polished,
Then laughed ""They will see some day
Smith made, and Gibson demolished.""

My business was song, song, song;
I chirped, cheeped, trilled and twittered,
""Kate Brown's on the boards ere long,
And Grisi's existence embittered!""

I earned no more by a warble
Than you by a sketch in plaster;
You wanted a piece of marble,
I needed a music-master.

We studied hard in our styles,
Chipped each at a crust like Hindoos,
For air looked out on the tiles,
For fun watched each other's windows.

You lounged, like a boy of the South,
Cap and blouse - nay, a bit of beard too;
Or you got it, rubbing your mouth
With fingers the clay adhered to.

And I - soon managed to find
Weak points in the flower-fence facing,
Was forced to put up a blind
And be safe in my corset-lacing.

No harm! It was not my fault
If you never turned your eye's tail up
As I shook upon E in alt,
Or ran the chromatic scale up:

For spring bade the sparrows pair,
And the boys and girls gave guesses,
And stalls in our street looked rare
With bulrush and watercresses.

Why did not you pinch a flower
In a pellet of clay and fling it?
Why did not I put a power
Of thanks in a look, or sing it?

I did look, sharp as a lynx,
(And yet the memory rankles,)
When models arrived, some minx
Tripped up-stairs, she and her ankles.

But I think I gave you as good!
""That foreign fellow, - who can know
How she pays, in a playful mood,
For his tuning her that piano?""

Could you say so, and never say
""Suppose we join hands and fortunes,
And I fetch her from over the way,
Her, piano, and long tunes and short tunes?""

No, no: you would not be rash,
Nor I rasher and something over:
You've to settle yet Gibson's hash,
And Grisi yet lives in clover.

But you meet the Prince at the Board,
I'm queen myself at bals-paré,
I've married a rich old lord,
And you're dubbed knight and an R.A.

Each life unfulfilled, you see;
It hangs still, patchy and scrappy:
We have not sighed deep, laughed free,
Starved, feasted, despaired, - been happy.

And nobody calls you a dunce,
And people suppose me clever:
This could but have happened once,
And we missed it, lost it for ever.",https://www.poetryfoundation.org/poems/43780/youth-and-art,,,ABAB,About the missed opportunity for romance between two young artists,"air, flower, tail, bird, eye"
Ballad,poetry_foundation,Memorabilia,Robert Browning,"Ah, did you once see Shelley plain,
And did he stop and speak to you?
And did you speak to him again?
How strange it seems, and new!

But you were living before that,
And you are living after,
And the memory I started at - 
My starting moves your laughter!

I crossed a moor, with a name of its own
And a certain use in the world no doubt,
Yet a hand's-breadth of it shines alone
'Mid the blank miles round about:

For there I picked up on the heather
And there I put inside my breast
A moulted feather, an eagle-feather - 
Well, I forget the rest.",https://www.poetryfoundation.org/poems/43767/memorabilia-56d22299dec53,,,ABAB,About a particularly profound moment in one's life and its connection to the past and present,breast
Ballad,poetry_foundation,Confessions,Robert Browning,"What is he buzzing in my ears?
""Now that I come to die,
Do I view the world as a vale of tears?""
Ah, reverend sir, not I!

What I viewed there once, what I view again
Where the physic bottles stand
On the table's edge, - is a suburb lane,
With a wall to my bedside hand.

That lane sloped, much as the bottles do,
From a house you could descry
O'er the garden-wall; is the curtain blue
Or green to a healthy eye?

To mine, it serves for the old June weather
Blue above lane and wall;
And that farthest bottle labelled ""Ether""
Is the house o'ertopping all.

At a terrace, somewhere near the stopper,
There watched for me, one June,
A girl: I know, sir, it's improper,
My poor mind's out of tune.

Only, there was a way... you crept
Close by the side, to dodge
Eyes in the house, two eyes except:
They styled their house ""The Lodge.""

What right had a lounger up their lane?
But, by creeping very close,
With the good wall's help, - their eyes might strain
And stretch themselves to Oes,

Yet never catch her and me together,
As she left the attic, there,
By the rim of the bottle labelled ""Ether,""
And stole from stair to stair,

And stood by the rose-wreathed gate. Alas,
We loved, sir - used to meet:
How sad and bad and mad it was - 
But then, how it was sweet!",https://www.poetryfoundation.org/poems/43750/confessions,,,ABAB,About a lover's confession regarding his secretive meetings with a girl,"blue, stretch, ears, eyes, weather, eye"
