form,source,title,author,content,poem_link-href,year,meter_pattern,rhyme_pattern,theme,imagery
Ballad,poetry_foundation,The Lullaby of a Lover,George Gascoigne,"Sing lullaby, as women do,
Wherewith they bring their babes to rest,
And lullaby can I sing too
As womanly as can the best.
With lullaby they still the child,
And if I be not much beguiled,
Full many wanton babes have I
Which must be stilled with lullaby.

First lullaby my youthful years;
It is now time to go to bed,
For crooked age and hoary hairs
Have won the haven within my head.
With lullaby, then, youth be still;
With lullaby content thy will;
Since courage quails and comes behind,
Go sleep, and so beguile thy mind.

Next, lullaby my gazing eyes,
Which wonted were to glance apace.
For every glass may now suffice
To show the furrows in my face;
With lullaby then wink awhile,
With lullaby your looks beguile;
Let no fair face nor beauty bright
Entice you eft with vain delight.

And lullaby, my wanton will;
Let reason's rule now reign thy thought,
Since all too late I find by skill
How dear I have thy fancies bought;
With lullaby now take thine ease,
With lullaby thy doubts appease.
For trust to this: if thou be still,
My body shall obey thy will.

Eke lullaby, my loving boy,
My little Robin, take thy rest;
Since age is cold and nothing coy,
Keep close thy coin, for so is best;
With lullaby be thou content,
With lullaby thy lusts relent,
Let others pay which hath mo pence;
Thou art too poor for such expense.

Thus lullaby, my youth, mine eyes,
My will, my ware, and all that was.
I can no mo delays devise,
But welcome pain, let pleasure pass;
With lullaby now take your leave,
With lullaby your dreams deceive;
And when you rise with waking eye,
Remember then this lullaby.",https://www.poetryfoundation.org/poems/56369/the-lullaby-of-a-lover,,,ABABCCDD,The speaker grapples with the inevitable march of time and the bittersweet farewells to the passions of youth,"face, head, eyes, eye"
Ballad,poetry_foundation,The Old Cloak,Anonymous,"This winter's weather it waxeth cold,
And frost it freezeth on every hill,
And Boreas blows his blast so bold
That all our cattle are like to spill.
Bell, my wife, she loves no strife;
She said unto me quietlye,
Rise up, and save cow Crumbock's life!
Man, put thine old cloak about thee!

He.   O Bell my wife, why dost thou flyte?
Thou kens my cloak is very thin:
It is so bare and over worn,
A crickè thereon cannot renn.
Then I'll no longer borrow nor lend;
For once I'll new apparell'd be;
To-morrow I'll to town and spend;
For I'll have a new cloak about me.

She.  Cow Crumbock is a very good cow:
She has been always true to the pail;
She has helped us to butter and cheese, I trow,
And other things she will not fail.
I would be loth to see her pine.
Good husband, counsel take of me:
It is not for us to go so fine - 
Man, take thine old cloak about thee!

He.   My cloak it was a very good cloak,
It hath been always true to the wear;
But now it is not worth a groat:
I have had it four and forty year'.
Sometime it was of cloth in grain:
'Tis now but a sigh clout, as you may see:
It will neither hold out wind nor rain;
And I'll have a new cloak about me.

She.  It is four and forty years ago
Sine the one of us the other did ken;
And we have had, betwixt us two,
Of children either nine or ten:
We have brought them up to women and men:
In the fear of God I trow they be.
And why wilt thou thyself misken?
Man, take thine old cloak about thee!

He.   O Bell my wife, why dost thou flyte?
Now is now, and then was then:
Seek now all the world throughout,
Thou kens not clowns from gentlemen:
They are clad in black, green, yellow and blue,
So far above their own degree.
Once in my life I'll take a view;
For I'll have a new cloak about me.

She. King Stephen was a worthy peer;
His breeches cost him but a crown;
He held them sixpence all too dear,
Therefore he called the tailor 'lown.'
He was a king and wore the crown,
And thou'se but of a low degree:
It's pride that puts this country down:
Man, take thy old cloak about thee!

He.   Bell my wife, she loves not strife,
Yet she will lead me, if she can;
And to maintain an easy life
I oft must yield, though I'm good-man.
It's not for a man with a woman to threap,
Unless he first give o'er the plea:
As we began, so will we keep,
And I'll take my old cloak about me.",https://www.poetryfoundation.org/poems/56371/the-old-cloak,,,ABABCDCD,"About a conversation between a husband and his wife, Bell, as they debate whether he should buy a new cloak or keep his old, worn one.","rain, blue, wind, boreas, blast, god, weather, pine, hill"
Ballad,poetry_foundation,The Cruel Mother,Anonymous,"She sat down below a thorn,
Fine flowers in the valley;
And there she has her sweet babe born,
And the green leaves they grow rarely.

""Smile na sae sweet, my bonnie babe,""
Fine flowers in the valley,
""And ye smile sae sweet, ye'll smile me dead,""
And the green leaves they grow rarely.

She's taen out her little penknife,
Fine flowers in the valley,
And twinn'd the sweet babe o' its life,
And the green leaves they grow rarely.

She's howket a grave by the light o' the moon,
Fine flowers in the valley,
And there she's buried her sweet babe in,
And the green leaves they grow rarely.

As she was going to the church,
Fine flowers in the valley,
She saw a sweet babe in the porch,
And the green leaves they grow rarely.

""O sweet babe, and thou were mine,""
Fine flowers in the valley,
""I was cleed thee in the silk so fine,""
And the green leaves they grow rarely.

""O mother dear, when I was thine,
Fine flowers in the valley,
Ye did na prove to me sae kind,""
And the green leaves they grow rarely.",https://www.poetryfoundation.org/poems/56373/the-cruel-mother-56d238cfe61a2,,,ABCB,"A murder ballad about a woman who gives birth to a child in the woods, kills it, and buries it. On her way back, she sees a child and laments her murder. ","flowers, moon"
Ballad,poetry_foundation,The Ballad of Blasphemous Bill,Robert W. Service,"I took a contract to bury the body of blasphemous Bill MacKie,
Whenever, wherever or whatsoever the manner of death he die  - 
Whether he die in the light o’ day or under the peak-faced moon;
In cabin or dance-hall, camp or dive, mucklucks or patent shoon;
On velvet tundra or virgin peak, by glacier, drift or draw;
In muskeg hollow or canyon gloom, by avalanche, fang or claw;
By battle, murder or sudden wealth, by pestilence, hooch or lead  - 
I swore on the Book I would follow and look till I found my tombless dead.

For Bill was a dainty kind of cuss, and his mind was mighty sot
On a dinky patch with flowers and grass in a civilized boneyard lot.
And where he died or how he died, it didn’t matter a damn
So long as he had a grave with frills and a tombstone “epigram.”
So I promised him, and he paid the price in good cheechako coin
(Which the same I blowed in that very night down in the Tenderloin).
Then I painted a three-foot slab of pine: “Here lies poor Bill MacKie,”
And I hung it up on my cabin wall and I waited for Bill to die.

Years passed away, and at last one day came a squaw with a story strange,
Of a long-deserted line of traps ’way back of the Bighorn range,
Of a little hut by the great divide, and a white man stiff and still,
Lying there by his lonesome self, and I figured it must be Bill.
So I thought of the contract I’d made with him, and I took down from the shelf
The swell black box with the silver plate he’d picked out for hisself;
And I packed it full of grub and “hooch,” and I slung it on the sleigh;
Then I harnessed up my team of dogs and was off at dawn of day.

You know what it’s like in the Yukon wild when it’s sixty-nine below;
When the ice-worms wriggle their purple heads through the crust of the pale blue snow;
When the pine-trees crack like little guns in the silence of the wood,
And the icicles hang down like tusks under the parka hood;
When the stove-pipe smoke breaks sudden off, and the sky is weirdly lit,
And the careless feel of a bit of steel burns like a red-hot spit;
When the mercury is a frozen ball, and the frost-fiend stalks to kill  - 
Well, it was just like that that day when I set out to look for Bill.

Oh, the awful hush that seemed to crush me down on every hand,
As I blundered blind with a trail to find through that blank and bitter land;
Half dazed, half crazed in the winter wild, with its grim heartbreaking woes,
And the ruthless strife for a grip on life that only the sourdough knows!
North by the compass, North I pressed; river and peak and plain
Passed like a dream I slept to lose and I waked to dream again.

River and plain and mighty peak  -  and who could stand unawed?
As their summits blazed, he could stand undazed at the foot of the throne of God.
North, aye, North, through a land accurst, shunned by the scouring brutes,
And all I heard was my own harsh word and the whine of the malamutes,
Till at last I came to a cabin squat, built in the side of a hill,
And I burst in the door, and there on the floor, frozen to death, lay Bill.

Ice, white ice, like a winding-sheet, sheathing each smoke-grimed wall;
Ice on the stove-pipe, ice on the bed, ice gleaming over all;
Sparkling ice on the dead man’s chest, glittering ice in his hair,
Ice on his fingers, ice in his heart, ice in his glassy stare;
Hard as a log and trussed like a frog, with his arms and legs outspread.
I gazed at the coffin I’d brought for him, and I gazed at the gruesome dead,
And at last I spoke: “Bill liked his joke; but still, goldarn his eyes,
A man had ought to consider his mates in the way he goes and dies.”

Have you ever stood in an Arctic hut in the shadow of the Pole,
With a little coffin six by three and a grief you can’t control?
Have you ever sat by a frozen corpse that looks at you with a grin,
And that seems to say: “You may try all day, but you’ll never jam me in”?
I’m not a man of the quitting kind, but I never felt so blue
As I sat there gazing at that stiff and studying what I’d do.
Then I rose and I kicked off the husky dogs that were nosing round about,
And I lit a roaring fire in the stove, and I started to thaw Bill out.

Well, I thawed and thawed for thirteen days, but it didn’t seem no good;
His arms and legs stuck out like pegs, as if they was made of wood.
Till at last I said: “It ain’t no use  -  he’s froze too hard to thaw;
He’s obstinate, and he won’t lie straight, so I guess I got to  -  saw.”
So I sawed off poor Bill’s arms and legs, and I laid him snug and straight
In the little coffin he picked hisself, with the dinky silver plate,
And I came nigh near to shedding a tear as I nailed him safely down;
Then I stowed him away in my Yukon sleigh, and I started back to town.

So I buried him as the contract was in a narrow grave and deep,
And there he’s waiting the Great Clean-up, when the Judgment sluice-heads sweep;
And I smoke my pipe and I meditate in the light of the Midnight Sun,
And sometimes I wonder if they was, the awful things I done.
And as I sit and the parson talks, expounding of the Law,
I often think of poor old Bill  -  and how hard he was to saw.",https://www.poetryfoundation.org/poems/46647/the-ballad-of-blasphemous-bill,,,AABBCCDD,"About the story of blasphemous Bill MacKie, a cowboy who defies the odds and refuses to back down in the face of danger. He rode through the wild west and died from the adventure. Written from the perpective of the one who bears the contract of burying Bill.","mates, spit, sun, worms, frills, hood, wood, hill, flowers, lot, gloom, eyes, chest, log, dogs, thaw, river, blue, talks, brutes, pine, moon, trees, peak, god, ball, heads"
Ballad,poetry_foundation,La Belle Dame sans Merci: A Ballad,John Keats,"O what can ail thee, knight-at-arms,
Alone and palely loitering?
The sedge has withered from the lake,
And no birds sing.

O what can ail thee, knight-at-arms,
       So haggard and so woe-begone?
The squirrel’s granary is full,
       And the harvest’s done.

I see a lily on thy brow,
       With anguish moist and fever-dew,
And on thy cheeks a fading rose
       Fast withereth too.

I met a lady in the meads,
       Full beautiful—a faery’s child,
Her hair was long, her foot was light,
       And her eyes were wild.

I made a garland for her head,
       And bracelets too, and fragrant zone;
She looked at me as she did love,
       And made sweet moan

I set her on my pacing steed,
       And nothing else saw all day long,
For sidelong would she bend, and sing
       A faery’s song.

She found me roots of relish sweet,
       And honey wild, and manna-dew,
And sure in language strange she said—
       ‘I love thee true’.

She took me to her Elfin grot,
       And there she wept and sighed full sore,
And there I shut her wild wild eyes
       With kisses four.

And there she lullèd me asleep,
       And there I dreamed—Ah! woe betide!—
The latest dream I ever dreamt
       On the cold hill side.

I saw pale kings and princes too,
       Pale warriors, death-pale were they all;
They cried—‘La Belle Dame sans Merci
       Thee hath in thrall!’

I saw their starved lips in the gloam,
       With horrid warning gapèd wide,
And I awoke and found me here,
       On the cold hill’s side.

And this is why I sojourn here,
       Alone and palely loitering,
Though the sedge is withered from the lake,
       And no birds sing.",https://www.poetryfoundation.org/poems/44475/la-belle-dame-sans-merci-a-ballad,,,ABCB,A medieval knight recounts a fanciful romp in the countryside with a fairy woman.,"dame, lips, faery, head, eyes, birds, hill"
Ballad,poetry_foundation,Sergeant-Major Money,Robert Graves,"It wasn't our battalion, but we lay alongside it,
So the story is as true as the telling is frank.
They hadn't one Line-officer left, after Arras,
Except a batty major and the Colonel, who drank.

'B' Company Commander was fresh from the Depot,
An expert on gas drill, otherwise a dud;
So Sergeant-Major Money carried on, as instructed,
And that's where the swaddies began to sweat blood.

His Old Army humour was so well-spiced and hearty
That one poor sod shot himself, and one lost his wits;
But discipline's maintained, and back in rest-billets
The Colonel congratulates 'B' Company on their kits.

The subalterns went easy, as was only natural
With a terror like Money driving the machine,
Till finally two Welshmen, butties from the Rhondda,
Bayoneted their bugbear in a field-canteen.

Well, we couldn't blame the officers, they relied on Money;
We couldn't blame the pitboys, their courage was grand;
Or, least of all, blame Money, an old stiff surviving
In a New (bloody) Army he couldn't understand.",https://www.poetryfoundation.org/poems/57251/sergeant-major-money,,,ABCB,About the situation of a Sergeant-Major named Money who was the only useful or sane officer left of a certain battalion during the battle of Arras. Money was pushing his men to the point of insanity of which it ended in death for some.,
Ballad,poetry_foundation,The Shooting of Dan McGrew,Robert W. Service,"A bunch of the boys were whooping it up in the Malamute saloon;
The kid that handles the music-box was hitting a jag-time tune;
Back of the bar, in a solo game, sat Dangerous Dan McGrew,
And watching his luck was his light-o'-love, the lady that's known as Lou.

When out of the night, which was fifty below, and into the din and the glare,
There stumbled a miner fresh from the creeks, dog-dirty, and loaded for bear.
He looked like a man with a foot in the grave and scarcely the strength of a louse,
Yet he tilted a poke of dust on the bar, and he called for drinks for the house.
There was none could place the stranger's face, though we searched ourselves for a clue;
But we drank his health, and the last to drink was Dangerous Dan McGrew.

There's men that somehow just grip your eyes, and hold them hard like a spell;
And such was he, and he looked to me like a man who had lived in hell;
With a face most hair, and the dreary stare of a dog whose day is done,
As he watered the green stuff in his glass, and the drops fell one by one.
Then I got to figgering who he was, and wondering what he'd do,
And I turned my head  -  and there watching him was the lady that's known as Lou.

His eyes went rubbering round the room, and he seemed in a kind of daze,
Till at last that old piano fell in the way of his wandering gaze.
The rag-time kid was having a drink; there was no one else on the stool,
So the stranger stumbles across the room, and flops down there like a fool.
In a buckskin shirt that was glazed with dirt he sat, and I saw him sway;
Then he clutched the keys with his talon hands  -  my God! but that man could play.

Were you ever out in the Great Alone, when the moon was awful clear,
And the icy mountains hemmed you in with a silence you most could hear;
With only the howl of a timber wolf, and you camped there in the cold,
A half-dead thing in a stark, dead world, clean mad for the muck called gold;
While high overhead, green, yellow and red, the North Lights swept in bars?  - 
Then you've a hunch what the music meant. . . hunger and night and the stars.

And hunger not of the belly kind, that's banished with bacon and beans,
But the gnawing hunger of lonely men for a home and all that it means;
For a fireside far from the cares that are, four walls and a roof above;
But oh! so cramful of cosy joy, and crowned with a woman's love  - 
A woman dearer than all the world, and true as Heaven is true  - 
(God! how ghastly she looks through her rouge,  -  the lady that's known as Lou.)

Then on a sudden the music changed, so soft that you scarce could hear;
But you felt that your life had been looted clean of all that it once held dear;
That someone had stolen the woman you loved; that her love was a devil's lie;
That your guts were gone, and the best for you was to crawl away and die.
'Twas the crowning cry of a heart's despair, and it thrilled you through and through  - 
""I guess I'll make it a spread misere"", said Dangerous Dan McGrew.

The music almost died away ... then it burst like a pent-up flood;
And it seemed to say, ""Repay, repay,"" and my eyes were blind with blood.
The thought came back of an ancient wrong, and it stung like a frozen lash,
And the lust awoke to kill, to kill ... then the music stopped with a crash,
And the stranger turned, and his eyes they burned in a most peculiar way;
In a buckskin shirt that was glazed with dirt he sat, and I saw him sway;
Then his lips went in in a kind of grin, and he spoke, and his voice was calm,
And ""Boys,"" says he, ""you don't know me, and none of you care a damn;
But I want to state, and my words are straight, and I'll bet my poke they're true,
That one of you is a hound of hell. . .and that one is Dan McGrew.""

Then I ducked my head, and the lights went out, and two guns blazed in the dark,
And a woman screamed, and the lights went up, and two men lay stiff and stark.
Pitched on his head, and pumped full of lead, was Dangerous Dan McGrew,
While the man from the creeks lay clutched to the breast of the lady that's known as Lou.

These are the simple facts of the case, and I guess I ought to know.
They say that the stranger was crazed with ""hooch,"" and I'm not denying it's so.
I'm not so wise as the lawyer guys, but strictly between us two  - 
The woman that kissed him and  -  pinched his poke  -  was the lady that's known as Lou.",https://www.poetryfoundation.org/poems/45082/the-shooting-of-dan-mcgrew,,,AABB,"Dan McGrew, a rough-neck prospector, and his sweetheat Lou meet with a stranger in a saloon, who appears to have had a past with. The two men shoot and kill each other, and Lou steals the gold the stranger had brought with him.","lips, louse, drink, drinks, devil, face, clue, mountains, head, eyes, stars, guts, dirt, bear, god, dog"
Ballad,poetry_foundation,Mr. Nobody,Anonymous,"I know a funny little man,
As quiet as a mouse,
Who does the mischief that is done
In everybody’s house!
There’s no one ever sees his face,
And yet we all agree
That every plate we break was cracked
By Mr. Nobody.

’Tis he who always tears out books,
Who leaves the door ajar,
He pulls the buttons from our shirts,
And scatters pins afar;
That squeaking door will always squeak,
For prithee, don’t you see,
We leave the oiling to be done
By Mr. Nobody.

He puts damp wood upon the fire
That kettles cannot boil;
His are the feet that bring in mud,
And all the carpets soil.
The papers always are mislaid;
Who had them last, but he?
There’s no one tosses them about
But Mr. Nobody.

The finger marks upon the door
By none of us are made;
We never leave the blinds unclosed,
To let the curtains fade.
The ink we never spill;   the boots
That lying round you see
Are not our boots, - they all belong
To Mr. Nobody.",https://www.poetryfoundation.org/poems/42914/mr-nobody,,,ABCBDEFE,"To portray family life, where kids do mischievous things but instead of blaming them, the family says that Mr Nobody has done it.","face, marks, tosses, soil, wood"
Ballad,poetry_foundation,The Haunted Oak,Paul Laurence Dunbar,"Pray why are you so bare, so bare,
Oh, bough of the old oak-tree;
And why, when I go through the shade you throw,
Runs a shudder over me?

My leaves were green as the best, I trow,
And sap ran free in my veins,
But I saw in the moonlight dim and weird
A guiltless victim's pains.

I bent me down to hear his sigh;
I shook with his gurgling moan,
And I trembled sore when they rode away,
And left him here alone.

They'd charged him with the old, old crime,
And set him fast in jail:
Oh, why does the dog howl all night long,
And why does the night wind wail?

He prayed his prayer and he swore his oath,
And he raised his hand to the sky;
But the beat of hoofs smote on his ear,
And the steady tread drew nigh.

Who is it rides by night, by night,
Over the moonlit road?
And what is the spur that keeps the pace,
What is the galling goad?

And now they beat at the prison door,
""Ho, keeper, do not stay!
We are friends of him whom you hold within,
And we fain would take him away

""From those who ride fast on our heels
With mind to do him wrong;
They have no care for his innocence,
And the rope they bear is long.""

They have fooled the jailer with lying words,
They have fooled the man with lies;
The bolts unbar, the locks are drawn,
And the great door open flies.

Now they have taken him from the jail,
And hard and fast they ride,
And the leader laughs low down in his throat,
As they halt my trunk beside.

Oh, the judge, he wore a mask of black,
And the doctor one of white,
And the minister, with his oldest son,
Was curiously bedight.

Oh, foolish man, why weep you now?
'Tis but a little space,
And the time will come when these shall dread
The mem'ry of your face.

I feel the rope against my bark,
And the weight of him in my grain,
I feel in the throe of his final woe
The touch of my own last pain.

And never more shall leaves come forth
On the bough that bears the ban;
I am burned with dread, I am dried and dead,
From the curse of a guiltless man.

And ever the judge rides by, rides by,
And goes to hunt the deer,
And ever another rides his soul
In the guise of a mortal fear.

And ever the man he rides me hard,
And never a night stays he;
For I feel his curse as a haunted bough,
On the trunk of a haunted tree.",https://www.poetryfoundation.org/poems/44195/the-haunted-oak,,,ABCB,"A horrifying story of racial violence told from the point of view of an oak tree bough. Because of the lynching, the tree is now haunted and withers.","face, sky, bears, ear, tree, oak, throat, bear, wind"
